stock_code,corp_name,event_type,report_nm,news_count,news_sentiment_score,hype_keyword_count,rumor_keyword_count,retail_keyword_count,positive_catalyst_keyword_count,risk_noise_keyword_count,social_attention_score,rumor_noise_score,risk_noise_score,attention_label,rumor_label,risk_label,source_text_sample
118000,메타케어,paid_in_capital_increase,[기재정정]주요사항보고서(유상증자결정),5.0,2.0,0,0,0,0,1,3.5,0,3,low_attention,no_rumor_signal,risk_noise_detected,"메타케어 [기재정정]주요사항보고서(유상증자결정) paid_in_capital_increase 서대문구, 청년 창업기업 맞춤형 역량 강화 특강 | 통장에 꽂히는 기술료…리가켐바이오 'R&D 선순환' 원년에 쏠린 눈 | 오픈놀 최대주주 지분 50% 보호예수 해제"
480370,씨케이솔루션,supply_contract,[기재정정]단일판매ㆍ공급계약체결              ,5.0,0.0,0,0,0,2,0,7.5,0,0,medium_attention,no_rumor_signal,no_risk_noise,"씨케이솔루션 [기재정정]단일판매ㆍ공급계약체결               supply_contract [52주] 최고가 7개, 최저가 124개... 지수 상승 | 반도체 쏠림에 얼어붙은 IPO 시장…하반기 훈풍 올까 [IPO의 새 지평을 ... | ""로봇·물류 멈추면 공장도 아웃""... 씨피시스템, 자동화 핵심 부품으로..."
068790,DMS,supply_contract,단일판매ㆍ공급계약체결              ,5.0,13.0,0,0,0,2,0,7.5,0,0,medium_attention,no_rumor_signal,no_risk_noise,"DMS 단일판매ㆍ공급계약체결               supply_contract DMS, 677억 규모 디스플레이패널 장비 공급 계약 | [공시] DMS, 676억원 디스플레이패널 제조용 공정장비 공급계약 | DMS, 中 CSOT 8세대 OLED 라인에 677억 장비 공급"
011930,신성이엔지,major_shareholder_change,최대주주등소유주식변동신고서              ,5.0,-1.0,0,0,0,0,1,3.5,0,3,low_attention,no_rumor_signal,risk_noise_detected,"신성이엔지 최대주주등소유주식변동신고서               major_shareholder_change ESG 등급이 자본시장 리스크 필터로···기업 경쟁력의 새 기준 | 신성이엔지, 2026년 상반기 ESG 종합평가 A등급 획득 | [전자는 지금] 삼성 OLED TV, 美 컨슈머리포트 평가 1위 外"
445090,에이직랜드,supply_contract,단일판매ㆍ공급계약체결              ,5.0,9.0,0,0,0,3,0,9.5,0,0,medium_attention,no_rumor_signal,no_risk_noise,"에이직랜드 단일판매ㆍ공급계약체결               supply_contract 에이직랜드, SK하이닉스와 318억 규모 주문형 반도체 설계 계약 | AI 데이터센터 시대...에이직랜드·SK하이닉스, 차세대 eSSD 개발 맞손 | 에이직랜드, SK하이닉스 차세대 eSSD 개발 참여...319억원 규모 계약 체..."
300080,플리토,supply_contract,[기재정정]단일판매ㆍ공급계약체결              ,5.0,3.0,0,0,0,2,0,7.5,0,0,medium_attention,no_rumor_signal,no_risk_noise,"플리토 [기재정정]단일판매ㆍ공급계약체결               supply_contract 플리토, 단일판매공급계약→주권매매거래 정지 예고 | 밀집도 분석, 다국어 안내 등…AI 기술로 관광 현장 문제 해결 | 한국관광공사, 국립공원과 전통시장에 AI 심은 이유"
